{
  "$schema": "https://json-schema.org/draft/2020-12/schema",
  "$id": "https://takos.dev/schemas/takos-profile.schema.json",
  "title": "takos-profile",
  "type": "object",
  "additionalProperties": false,
  "required": [
    "schema_version",
    "name",
    "display_name",
    "description",
    "version",
    "kind",
    "base",
    "activitypub",
    "metadata"
  ],
  "properties": {
    "schema_version": {
      "const": "1.0"
    },
    "name": {
      "type": "string",
      "pattern": "^[a-z0-9][a-z0-9\\-]*$"
    },
    "display_name": {
      "type": "string",
      "minLength": 1,
      "maxLength": 128
    },
    "description": {
      "type": "string",
      "minLength": 1,
      "maxLength": 512
    },
    "version": {
      "type": "string",
      "pattern": "^(0|[1-9]\\d*)\\.(0|[1-9]\\d*)\\.(0|[1-9]\\d*)(?:-[0-9A-Za-z-]+(?:\\.[0-9A-Za-z-]+)*)?(?:\\+[0-9A-Za-z-]+(?:\\.[0-9A-Za-z-]+)*)?$"
    },
    "kind": {
      "const": "distro"
    },
    "tags": {
      "type": "array",
      "items": {
        "type": "string",
        "minLength": 1
      },
      "uniqueItems": true
    },
    "base": {
      "type": "object",
      "additionalProperties": false,
      "required": ["core_version", "repo"],
      "properties": {
        "core_version": {
          "type": "string",
          "minLength": 1
        },
        "repo": {
          "type": "string",
          "format": "uri"
        },
        "commit": {
          "type": "string",
          "minLength": 1
        }
      }
    },
    "runtime": {
      "type": "object",
      "additionalProperties": false,
      "required": ["supported"],
      "properties": {
        "supported": {
          "type": "array",
          "items": {
            "type": "string",
            "minLength": 1
          },
          "minItems": 1,
          "uniqueItems": true
        },
        "default": {
          "type": "string",
          "minLength": 1
        }
      }
    },
    "activitypub": {
      "type": "object",
      "additionalProperties": false,
      "required": ["contexts"],
      "properties": {
        "contexts": {
          "type": "array",
          "items": {
            "type": "string",
            "format": "uri",
            "pattern": "^https?://"
          },
          "minItems": 1,
          "uniqueItems": true
        },
        "profile": {
          "type": "string",
          "format": "uri"
        },
        "node_type": {
          "type": "string",
          "minLength": 1
        },
        "extensions": {
          "type": "array",
          "items": {
            "type": "object",
            "additionalProperties": false,
            "required": ["id"],
            "properties": {
              "id": {
                "type": "string",
                "minLength": 1
              },
              "description": {
                "type": "string",
                "minLength": 1
              },
              "spec_url": {
                "type": "string",
                "format": "uri",
                "pattern": "^https?://"
              }
            }
          },
          "uniqueItems": true
        }
      }
    },
    "ui": {
      "type": "object",
      "additionalProperties": false,
      "properties": {
        "client_repo": {
          "type": "string",
          "format": "uri"
        },
        "theme": {
          "type": "string",
          "minLength": 1
        }
      }
    },
    "ai": {
      "type": "object",
      "additionalProperties": false,
      "required": [
        "enabled",
        "requires_external_network",
        "providers",
        "actions"
      ],
      "properties": {
        "enabled": {
          "type": "boolean"
        },
        "requires_external_network": {
          "type": "boolean"
        },
        "providers": {
          "type": "array",
          "items": {
            "type": "string",
            "minLength": 1
          },
          "minItems": 1,
          "uniqueItems": true
        },
        "actions": {
          "type": "array",
          "items": {
            "type": "string",
            "minLength": 1
          },
          "minItems": 1,
          "uniqueItems": true
        }
      }
    },
    "metadata": {
      "type": "object",
      "additionalProperties": false,
      "required": ["maintainer", "license"],
      "properties": {
        "maintainer": {
          "type": "object",
          "additionalProperties": false,
          "required": ["name"],
          "properties": {
            "name": {
              "type": "string",
              "minLength": 1
            },
            "email": {
              "type": "string",
              "format": "email"
            },
            "url": {
              "type": "string",
              "format": "uri"
            }
          }
        },
        "license": {
          "type": "string",
          "minLength": 1
        },
        "homepage": {
          "type": "string",
          "format": "uri"
        },
        "repo": {
          "type": "string",
          "format": "uri"
        },
        "docs": {
          "type": "string",
          "format": "uri"
        }
      }
    }
  }
}
